{
  "$schema": "https://json-schema.org/draft/2020-12/schema",
  "type": "object",
  "properties": {
    "schema_version": {
      "type": "number",
      "const": 1
    },
    "review_request_id": {
      "type": "string",
      "pattern": "^[a-zA-Z0-9][a-zA-Z0-9_-]{0,95}$"
    },
    "workflow_id": {
      "type": "string",
      "pattern": "^[a-zA-Z0-9][a-zA-Z0-9_-]{0,95}$"
    },
    "plan_revision": {
      "type": "integer",
      "exclusiveMinimum": 0,
      "maximum": 9007199254740991
    },
    "snapshot_id": {
      "type": "string"
    },
    "verdict": {
      "type": "string",
      "enum": [
        "pass",
        "findings",
        "incomplete"
      ]
    },
    "coverage": {
      "type": "object",
      "properties": {
        "all_changed_files_reviewed": {
          "type": "boolean"
        },
        "all_requirements_checked": {
          "type": "boolean"
        },
        "upstream_downstream_checked": {
          "type": "boolean"
        },
        "security_checked": {
          "type": "boolean"
        },
        "tests_validity_checked": {
          "type": "boolean"
        },
        "files": {
          "type": "array",
          "items": {
            "type": "string"
          }
        }
      },
      "required": [
        "all_changed_files_reviewed",
        "all_requirements_checked",
        "upstream_downstream_checked",
        "security_checked",
        "tests_validity_checked",
        "files"
      ],
      "additionalProperties": false
    },
    "findings": {
      "type": "array",
      "items": {
        "type": "object",
        "properties": {
          "id": {
            "type": "string",
            "pattern": "^[a-zA-Z0-9][a-zA-Z0-9_-]{0,95}$"
          },
          "severity": {
            "type": "string",
            "enum": [
              "P0",
              "P1",
              "P2",
              "P3"
            ]
          },
          "repo_id": {
            "type": "string",
            "pattern": "^[a-zA-Z0-9][a-zA-Z0-9_-]{0,95}$"
          },
          "path": {
            "type": "string",
            "minLength": 1,
            "maxLength": 1024
          },
          "line": {
            "type": "integer",
            "exclusiveMinimum": 0,
            "maximum": 9007199254740991
          },
          "trigger": {
            "type": "string",
            "minLength": 1
          },
          "evidence": {
            "type": "string",
            "minLength": 1
          },
          "consequence": {
            "type": "string",
            "minLength": 1
          },
          "relation_to_change": {
            "type": "string",
            "enum": [
              "introduced",
              "in_scope",
              "historical",
              "suggestion"
            ]
          },
          "disposition": {
            "type": "string",
            "enum": [
              "confirmed",
              "false_positive",
              "out_of_scope"
            ]
          },
          "reason": {
            "type": "string",
            "minLength": 1
          }
        },
        "required": [
          "id",
          "severity",
          "repo_id",
          "path",
          "line",
          "trigger",
          "evidence",
          "consequence",
          "relation_to_change",
          "disposition",
          "reason"
        ],
        "additionalProperties": false
      }
    },
    "unresolved_questions": {
      "type": "array",
      "items": {
        "type": "string"
      }
    },
    "repair_plan": {
      "anyOf": [
        {
          "type": "object",
          "properties": {
            "task_model": {
              "type": "string",
              "const": "leaf-v1"
            },
            "modules": {
              "minItems": 1,
              "type": "array",
              "items": {
                "type": "object",
                "properties": {
                  "id": {
                    "type": "string",
                    "pattern": "^[a-zA-Z0-9][a-zA-Z0-9_-]{0,95}$"
                  },
                  "title": {
                    "type": "string",
                    "minLength": 1
                  }
                },
                "required": [
                  "id",
                  "title"
                ],
                "additionalProperties": false
              }
            },
            "markdown": {
              "type": "string",
              "minLength": 80
            },
            "complexity": {
              "type": "string",
              "enum": [
                "simple",
                "complex"
              ]
            },
            "reason": {
              "type": "string",
              "minLength": 1
            },
            "decisions": {
              "type": "array",
              "items": {
                "type": "object",
                "properties": {
                  "question": {
                    "type": "string"
                  },
                  "answer": {
                    "type": "string",
                    "minLength": 1
                  },
                  "source": {
                    "type": "string",
                    "minLength": 1
                  }
                },
                "required": [
                  "question",
                  "answer",
                  "source"
                ],
                "additionalProperties": false
              }
            },
            "unresolved_decisions": {
              "minItems": 0,
              "maxItems": 0,
              "type": "array",
              "items": {
                "type": "string"
              }
            },
            "scope": {
              "type": "object",
              "properties": {
                "repository_paths": {
                  "default": {},
                  "type": "object",
                  "propertyNames": {
                    "type": "string",
                    "pattern": "^[a-zA-Z0-9][a-zA-Z0-9_-]{0,95}$"
                  },
                  "additionalProperties": {
                    "minItems": 1,
                    "type": "array",
                    "items": {
                      "type": "string",
                      "minLength": 1,
                      "maxLength": 1024
                    }
                  }
                },
                "allowed_paths": {
                  "minItems": 1,
                  "type": "array",
                  "items": {
                    "type": "string",
                    "minLength": 1,
                    "maxLength": 1024
                  }
                },
                "protected_paths": {
                  "default": [
                    ".git",
                    ".agents",
                    ".codex"
                  ],
                  "type": "array",
                  "items": {
                    "type": "string"
                  }
                },
                "allow_dependency_changes": {
                  "default": false,
                  "type": "boolean"
                },
                "allow_public_api_changes": {
                  "default": false,
                  "type": "boolean"
                }
              },
              "required": [
                "repository_paths",
                "allowed_paths",
                "protected_paths",
                "allow_dependency_changes",
                "allow_public_api_changes"
              ],
              "additionalProperties": false
            },
            "tasks": {
              "minItems": 1,
              "type": "array",
              "items": {
                "type": "object",
                "properties": {
                  "module_id": {
                    "type": "string",
                    "pattern": "^[a-zA-Z0-9][a-zA-Z0-9_-]{0,95}$"
                  },
                  "completion_checks": {
                    "minItems": 1,
                    "type": "array",
                    "items": {
                      "type": "object",
                      "properties": {
                        "path": {
                          "type": "string",
                          "minLength": 1,
                          "maxLength": 1024
                        },
                        "contains": {
                          "type": "string",
                          "minLength": 5
                        }
                      },
                      "required": [
                        "path",
                        "contains"
                      ],
                      "additionalProperties": false
                    }
                  },
                  "repo_id": {
                    "type": "string",
                    "pattern": "^[a-zA-Z0-9][a-zA-Z0-9_-]{0,95}$"
                  },
                  "id": {
                    "type": "string",
                    "pattern": "^[a-zA-Z0-9][a-zA-Z0-9_-]{0,95}$"
                  },
                  "title": {
                    "type": "string",
                    "minLength": 1
                  },
                  "requirements": {
                    "minItems": 1,
                    "type": "array",
                    "items": {
                      "type": "string",
                      "pattern": "^[a-zA-Z0-9][a-zA-Z0-9_-]{0,95}$"
                    }
                  },
                  "depends_on": {
                    "default": [],
                    "type": "array",
                    "items": {
                      "type": "string",
                      "pattern": "^[a-zA-Z0-9][a-zA-Z0-9_-]{0,95}$"
                    }
                  },
                  "paths": {
                    "minItems": 1,
                    "type": "array",
                    "items": {
                      "type": "string",
                      "minLength": 1,
                      "maxLength": 1024
                    }
                  },
                  "inputs": {
                    "type": "string",
                    "minLength": 1
                  },
                  "implementation": {
                    "type": "string",
                    "minLength": 10
                  },
                  "preserve": {
                    "type": "string",
                    "minLength": 1
                  },
                  "completion": {
                    "type": "string",
                    "minLength": 5
                  },
                  "test_ids": {
                    "minItems": 1,
                    "type": "array",
                    "items": {
                      "type": "string",
                      "pattern": "^[a-zA-Z0-9][a-zA-Z0-9_-]{0,95}$"
                    }
                  },
                  "stop_conditions": {
                    "type": "string",
                    "minLength": 1
                  }
                },
                "required": [
                  "id",
                  "title",
                  "requirements",
                  "depends_on",
                  "paths",
                  "inputs",
                  "implementation",
                  "preserve",
                  "completion",
                  "test_ids",
                  "stop_conditions"
                ],
                "additionalProperties": false
              }
            },
            "tests": {
              "minItems": 1,
              "type": "array",
              "items": {
                "type": "object",
                "properties": {
                  "id": {
                    "type": "string",
                    "pattern": "^[a-zA-Z0-9][a-zA-Z0-9_-]{0,95}$"
                  },
                  "task_ids": {
                    "minItems": 1,
                    "type": "array",
                    "items": {
                      "type": "string",
                      "pattern": "^[a-zA-Z0-9][a-zA-Z0-9_-]{0,95}$"
                    }
                  },
                  "layer": {
                    "type": "string",
                    "enum": [
                      "unit",
                      "integration",
                      "e2e",
                      "opentabs"
                    ]
                  },
                  "command_id": {
                    "type": "string",
                    "pattern": "^[a-zA-Z0-9][a-zA-Z0-9_-]{0,95}$"
                  },
                  "scene_id": {
                    "type": "string",
                    "pattern": "^[a-zA-Z0-9][a-zA-Z0-9_-]{0,95}$"
                  },
                  "steps": {
                    "minItems": 1,
                    "type": "array",
                    "items": {
                      "type": "string",
                      "minLength": 1
                    }
                  },
                  "assertions": {
                    "minItems": 1,
                    "type": "array",
                    "items": {
                      "type": "string",
                      "minLength": 1
                    }
                  },
                  "expected_case_ids": {
                    "minItems": 1,
                    "type": "array",
                    "items": {
                      "type": "string",
                      "minLength": 1
                    }
                  },
                  "timeout_seconds": {
                    "default": 300,
                    "type": "integer",
                    "exclusiveMinimum": 0,
                    "maximum": 7200
                  }
                },
                "required": [
                  "id",
                  "task_ids",
                  "layer",
                  "steps",
                  "assertions",
                  "expected_case_ids",
                  "timeout_seconds"
                ],
                "additionalProperties": false
              }
            },
            "exemptions": {
              "default": [],
              "type": "array",
              "items": {
                "type": "object",
                "properties": {
                  "layer": {
                    "type": "string",
                    "enum": [
                      "unit",
                      "integration",
                      "e2e",
                      "opentabs"
                    ]
                  },
                  "reason": {
                    "type": "string",
                    "minLength": 10
                  }
                },
                "required": [
                  "layer",
                  "reason"
                ],
                "additionalProperties": false
              }
            },
            "baselines": {
              "type": "object",
              "propertyNames": {
                "type": "string",
                "pattern": "^[a-zA-Z0-9][a-zA-Z0-9_-]{0,95}$"
              },
              "additionalProperties": {
                "type": "string",
                "pattern": "^[a-f0-9]{40,64}$"
              }
            },
            "project_config_hash": {
              "type": "string",
              "minLength": 1
            }
          },
          "required": [
            "markdown",
            "complexity",
            "reason",
            "decisions",
            "unresolved_decisions",
            "scope",
            "tasks",
            "tests",
            "exemptions",
            "baselines",
            "project_config_hash"
          ],
          "additionalProperties": false
        },
        {
          "type": "null"
        }
      ]
    },
    "commit_message": {
      "type": "string",
      "minLength": 1,
      "maxLength": 500
    }
  },
  "required": [
    "schema_version",
    "review_request_id",
    "workflow_id",
    "plan_revision",
    "snapshot_id",
    "verdict",
    "coverage",
    "findings",
    "unresolved_questions",
    "repair_plan",
    "commit_message"
  ],
  "additionalProperties": false
}
